index,text,label
train_01_0_892,The State alleged hacked Sabata Petros Chale thirty-nine death Marikana West December eight two thousand and sixteen allegedly allocation low cost RDP houses Marikana West Extension two,1
train_01_1_2714,Chale allegedly chased group thirty people hacked death pangas axes spears,0
train_01_10_2619,The farmworkers strike resumed Tuesday demands met,1
train_01_100_2680,Demonstrators filed permit hold rally Saturday Yuen Long district outskirts Hong Kong dozens masked men chased beat commuters protesters wooden poles metal rods leaving least forty-five people hospital,1
train_01_101_3090,Footage attack included pregnant woman hit protesters punched kneed commuters screaming crying trying shield emerged Sunday night fuelling political unrest demonstrators opposition lawmakers others demanded answers authorities failing stop violence,1
train_01_102_274,Max Chung delivered application letter objection police required hold rally said want show public international community Hong Kongers never surrender front terrorism show solidarity say terrorism stand Chung said Yuen Long terrorist attack choice take back The protests principally controversial bill would allow suspects extradited Hong Kong mainland China taken new demands including investigation police use rubber bullets teargas physical violence protesters,0
train_01_103_2840,Protesters angry police slow response attack Yuen Long pursuit case,1
train_01_104_2950,The violence Yuen Long heightened tensions fears attacks,1
train_01_105_3071,Tuesday evening unverified footage showed men white gathering Tuen Mun another city near Yuen Long New Territories,0
train_01_106_430,Hong Kong leader Carrie Lam said shocking violence Yuen Long would investigated devoted comments criticising protesters surrounded Beijing liaison office Hong Kong defaced national emblem People Republic China Sunday,0
train_01_107_3187,Tuesday group aviation staff called protest Hong Kong airport Friday condemn government police ignoring random attacks citizens Yuen Long,1
train_01_108_2227,Yuen Long Chung protesters demanding government conducts independent investigation officially characterises violence cross-border terrorist attack,0
train_01_109_2504,Hailey Leung university student attending protests summer said The fear gangs definitely stronger fear use violence police Her parents supportive protests since violence Yuen Long asked attend,1
train_01_11_1696,National Highways Authority India Case Cops Fail Produce Accused Court,0
train_01_11_3048,10th September two thousand and fifteen KOCHI Anoop George main accused case related attack office National Highway Authority India National Highways Authority India Kalamassery could produced Ernakulam District Principal Sessions Court Wednesday jail authorities Coimbatore failed arrange escort,1
train_01_110_585,Suddenly motley group slogan-shouting students emerged dhaba,0
train_01_111_2444,They exhorted join protest recommendations Mandal Commission implemented day earlier,0
train_01_112_916,Thus joined sloganeering,0
train_01_113_1930,time self-styled leaders commandeered DTC buses nearly two hundred postgraduate doctoral students gathered intersection later became epicentre protests rechristened euphemistically Kranti Chowk,0
train_01_114_700,Some hotheads tried gatecrash provoking policemen action charged ferociously dispersing crowd within minutes,1
train_01_115_751,That night Doordarshan telecast news protests,0
train_01_116_2822,Jammu Delhi court blast accused killed Kishtwar August seven two thousand and twelve IST two thousand and eleven Delhi High Court blast accused Amir Ali Kamal among two Hizb Mujahideen militants killed Monday shootout security forces mountainous Kishtwar district Jammu Kashmir police said,1
train_01_117_510,closed hideout militants fire fight began continued hour said,0
train_01_118_925,According reports two militants shot dead encounter,0
train_01_119_2743,One Amir Ali Kamal code name Akram prime accused Delhi High Court blast officer said,0
train_01_12_692,January year group persons attacked National Highways Authority India office Kalamassery distributed notices supporting armed revolt government,0
train_01_120_1954,Akram radar National Investigation Agency NIA believed arranged explosives planter blast,1
train_01_121_2530,accused Delhi High Court blast Sep seven two thousand and eleven least ten people killed seventy injured,1
train_01_122_1324,The NIA wanted catch Akram alive could provide clues resolving blast case,1
train_01_123_933,The Kishtwar area focus ever since Delhi High Court blast first mails claiming responsibility blast emanated,0
train_01_124_1264,Two youths arrested later allegedly involved blast,1
train_01_125_656,Modi visited homes six victims serial blasts rocked Patna Gandhi Maidan parts city visit address Hunkar Rally October twenty-seven,0
train_01_126_845,Narendra Modi avoided visiting victims two thousand and two riots state long time lost time burning aviation fuel dashing Patna twice one week express condolences score points rambunctious rivals,1
train_01_127_533,Now charged exploiting grief terror victims 26/10,0
train_01_128_1654,visiting families Patna blast victims Narendra Modi drilling home point NiKu least bothered personal tragedies people,0
train_01_129_3114,August year militantly aggressive Kurmis mowed fourteen Dalits sleepy hamlet Belchchi Nalanda district,0
train_01_13_1285,Both Anoop Ramanan also accused case related attack Nitta Gelatin office Panampilly Nagar last year,0
train_01_130_1739,Indira landed Nalanda waded floodwaters elephant visit Dalit family lost members caste pogrom,1
train_01_131_3262,The grief list also includes nights spent Rahul Dalit colonies visits Manmohan Singh Sonia Gandhi Chhattisgarh top Congress leaders massacred Naxalites,0
train_01_132_730,Modiites reminding Congress trips Sonia Prime Minister made Muzzafarnagar forty-three killed worst-ever communal clashes decades,0
train_01_133_2021,Bandhopadhay also said two Trinamool Congress workers killed Sashan North twenty-four Parganas district recently,0
train_01_134_138,car Union ministers Mukul Roy Sultan Ahmed attacked allegedly CPM cadres Wednesday alleged,0
train_01_135_1341,December five two thousand and seventeen IST Say officials panchayat level colluding locals Residents Varavani panchayat staged protest collectorate Monday illegal tapping drinking water supplied pipelines Cauvery combined water supply scheme irregular supply water villages,1
train_01_135_3340,Ramanathapuram Residents protest illegal water connections,1
train_01_136_3243,Led Sagayamadha office-bearer All India Farm Workers Association villagers including large number women panchayat comprising six villages staged protest urging district administration immediately disconnect illegal water connections ensure uninterrupted water supply,1
train_01_137_721,Committed Seeking Justice Behalf All 26/11 Victims fifth August two thousand and fifteen Prime Minister NEW YORK The committed pursuing justice behalf victims two thousand and eight Mumbai attack matter arduous task top Indian-origin American diplomat said,0
train_01_138_219,certainly reiterated support commitment India efforts seek justice behalf victims 26/11 attack Assistant Secretary State South Central Asian Affairs Nisha Desai Biswal told PTI asked delay bringing justice perpetrators two thousand and eight terror attacks,0
train_01_139_144,Biswal travelled city Washington speak Indian Consulate General Media-India Lecture Series yesterday said large number Indian victims attack Americans also lost lives,1
train_01_14_745,condemns attack NSS Karayogams eighth May two thousand and eleven THIRUVANANTHAPURAM Chief Minister Achuthanandan condemned recent attacks NSS Karayogams,0
train_01_140_1382,Given nearly seven years passed since horrendous terror attacks claimed one hundred and sixty lives injured many others Biswal said bringing justice victims terror attacks may appear arduous andlong-drawn process,0
train_01_141_915,Biswal underlined part offered rewards information leading arrest prosecution individuals associated Mumbai attack,0
train_01_142_3024,Referring terror attack Punjab Gurdaspur district July twenty-seven Biswal said strongly condemned expressed concern attack,0
train_01_143_2988,She said expressed cooperation ith Indian authorities specific aspects incident,0
train_01_144_3332,media reports night vision device used three terrorists Gurdaspur attack markings Biswal said conversation Indian authorities try ascertain trace origins equipment found,1
train_01_145_2115,continue work closely Indian government issues said adding ongoing process working Indian authorities address issues concern emanating incident,1
train_01_146_1588,The step came RLD workers led district party president Ajit Rathi former minister Dharamvir Balyan MLC Chaudhry Mushtaq staged dharna outside office yesterday submitted memorandum,0
train_01_147_2629,CHENNAI Chennai sees first ever hunger fast HCL April eight two thousand and thirteen IST For first time Chennai graduates denied jobs multi-national corporation recruited college campuses staged hunger strike Sunday,0
train_01_148_3016,many fifty-nine recruits graduated different colleges State came together fourth time demand answers HCL Technologies company recruited two thousand and eleven,1
train_01_149_183,The recruits Valluvar Kottam shouted slogans including HCL lend ears give back two years undertaking day-long fast,0
train_01_15_1134,When asked series attacks Karayogams said attacks could entertained,0
train_01_150_877,Three Arrested Bimbola Clash eighteenth June two thousand and fourteen DHENKANAL Three persons arrested Tuesday alleged involvement killing naib sarpanch clash members two communities Bimbola village Dhenkanal Sadar police limits Monday,1
train_01_151_2547,The naib sarpanch killed seventeen others seriously injured clash use village field,1
train_01_152_883,Bimbola village turned battle field rival groups wielding guns took centre stage,1
train_01_153_1992,The clash took place use field,1
train_01_154_2700,Police said detained group thirty forty persons general caste Monday morning managed escape,0
train_01_155_381,However returning home night Pradhan intercepted killed,0
train_01_156_2596,Soon clash ensued supporters Pradhan rival group seventeen persons injured,0
train_01_157_909,Ishrat Jahan nineteen year-old college student killed along three others June fifteen two thousand and four allegedly team Crime Branch officials outskirts Ahmedabad intelligence inputs group Lashkar terrorists plotted kill Gujarat Chief Minister Narendra Modi avenge two thousand and two communal riots state,1
train_01_158_1326,thirteen Sep two thousand and fourteen Three people sentenced death Yunnan court role attack Kunming rail station killed thirty-one people injured one hundred and forty-one March,1
train_01_158_2387,Kunming railway station attack Three given death penalty Kunming rail station attack Influenced religious extremism trio plotted knife rampage court says fourth defendant handed life sentence taking part,1
train_01_158_2607,PUBLISHED Friday twelve September two thousand and fourteen Jinping urges China central Asian neighbours help step extremism fight,0
train_01_159_853,Patigul Tohti wounded captured scene jailed life convicted taking part attack,1
train_01_16_289,The NSS Karayogams attacked Thrissur Thiruvananthapuram NSS secretary Sukumaran Nair said NSS support LDF recent Assembly elections want Achuthanandan come back power another term,1
train_01_160_3156,Tohtunyaz helped acquire ten knives used attack,0
train_01_161_1462,Two days attack local police arrested Tohtunyaz Ehet Muhammad tried illegally cross Vietnam via Honghe county court said,1
train_01_162_2296,They confess planned attack capture bear full responsibility loss life court said,1
train_01_163_2481,Despite losing contact three men five members group went ahead attack,0
train_01_164_724,Initial reports variety media quoting witnesses said eight people brandished knives Saturday March one attack,0
train_01_165_3168,Police announced Monday attack three suspects taken custody appears reference trio detained February twenty-seven,0
train_01_166_3248,least five people tried attack Xinhua reported,0
train_01_167_3395,The government blamed separatist forces Xinjiang attack,1
train_01_168_1577,Mainland authorities launched massive crackdown terrorism wake string violent attacks restive Xinjiang region cities mainland,1
train_01_169_1273,The pair oaths invalid able retake China rubberstamp legislature said one day thousands marched streets Hong Kong protest Beijing interference,1
train_01_169_2216,During chaotic swearing-in ceremony last month Yau Leung thumbed noses Beijing refusing declare allegiance China carrying blue flags reading Hong Kong China,1
train_01_17_2868,The attack Karayogams sparked sharp reactions CPM leaders,1
train_01_170_841,But many Hong Kong complain freedoms eroded recent years leading nearly three months street protests two thousand and fourteen known umbrella revolution election September year six politicians pushing greater autonomy city,1
train_01_171_2460,"About 13,000 marched Sunday protest China intervention ending clashes police outside Beijing main presence city four arrests",1
train_01_172_1392,Some schools postpone mid-term examinations due bandh additional task conducting tests resuming classes,1
train_01_173_1317,Yes fellow assured government bosses July one two thousand and three protest march would draw mere thousands half million actually turned,0
train_01_174_2400,Taxi strike impacts businesses Soshanguve Brenda Masilela PRETORIA November eight ANA Employees Soshanguve Plaza south Pretoria arrived work Wednesday find businesses closed amid fears taxi strike might turn violent,1
train_01_175_638,27th February two thousand and nine COLOMBO India Thursday told Pakistan recognised Islamabad done far investigate involvement Pakistanis Mumbai attacks curb crossborder terrorism lot remained done ensure attacks recur,1
train_01_175_1259,lot done India tells Pakistan,0
train_01_176_2686,Foreign Secretary Shivshankar Menon discussed bilateral issues Pakistani counterpart Salman Bashir sidelines SAARC Foreign Secretaries meeting said Islamabad would bring perpetrators Mumbai attack justice give credible evidence dismantling terrorist infrastructure soil Pakistan,0
train_01_177_2012,About one hundred and twenty-five bus operators across Gauteng stopped reporting duty two weeks ago following dispute mileage payment,1
train_01_178_20,"Over 60,000 pupils left stranded strike",1
train_01_179_2901,Flash strike guards delays suburban trains Indian Express Express News Service Express News Service Fri Nov thirty two thousand and twelve hrs Most guards local trains abstained work Thursday protesting irritable behaviour area officer Churchgate forcing station masters traffic inspectors take role,1
train_01_18_1447,going argue evidence strikers Marikana August two thousand and twelve attacked police kicked,0
train_01_180_576,Four days ago guard Rakesh Jha gone hunger strike Churchgate Station denied leave despite applying two months back,1
train_01_181_1327,guard said When Jha get leave till four hours departure train hanged poster around neck announcing indefinite hunger strike,1
train_01_182_2469,All four hundred and seventeen guards suburban section refused work extra hours protest,1
train_01_183_1201,The Left wiped Gandhi said rally,0
train_01_184_444,"There anarchy everywhere misrule pervasive conspiracy corruption told gathering 30,000 people",0
train_01_185_1146,She directly name Bhatta-Parsaul twin villages emerged epicentre agitation land acquisition Uttar Pradesh government expressway project specifically mentioned atrocities farmers,0
train_01_186_1455,Her son Congress general secretary Rahul Gandhi taken issue big way staging daylong sit-in village four people including two police personnel killed clashes,1
train_01_187_2665,Scores students teachers women rights organisations yesterday staged protest outside college demanding Thampu resignation shielding accused,1
train_01_188_345,Protests Kupwara molestation girl Indian Express Agencies Agencies Srinagar Thu Jul nine two thousand and nine hrs Locals took streets frontier district Kupwara today demanding arrest territorial army jawan allegedly tried molest young woman following committed suicide,1
train_01_189_525,After family members narrated incident neighbours people came road held demonstrations,1
train_01_19_1486,Mpofu said Lt-Col Kaizer Modiba fabricating evidence violence mineworkers strike Marikana near Rustenburg North West position witness attack,1
train_01_190_473,Tiruvannamalai Cab drivers owners take rally May twenty-two two thousand and twelve IST Tourist cab drivers owners took rally Monday demanding scrap lifetime tax system introduced Tamil Nadu government,1
train_01_191_1787,The rally started Kamaraj statue proceeded important roads town culminating front Revenue Divisional Office,0
train_01_192_1004,Tiruvannamalai District Tourist Car Van Dirvers-Owners Welfare Association organised rally insisted old tax system continue,0
train_01_193_3303,end rally submitted memorandum Revenue Divisional Officer Bupathi,0
train_01_194_1851,three Cong workers killed phase-IV eve Indian Express Kolkata Mon Jul twenty-two two thousand and thirteen hrs eve fourth phase panchayat elections widespread incidents violence led death three Congress workers Sunday,1
train_01_195_373,Police said two Congress workers Nurmohhamad Sheikh Ahad Ali killed hit crude bombs late Saturday night Kapasdanga Murshidabad district,1
train_01_196_3012,TMC workers accused leading attacks,0
train_01_197_285,There reports skirmishes clashes including stone pelting area two policemen injured,1
train_01_198_2191,Another Congress worker Repon Sheikh killed Bharatpur district clash rival party supporters police said,1
train_01_199_236,Speaking news channel Chief Minister Mamata Banerjee shrugged allegations Trinamool cadres behind killing Congress workers,0
train_01_2_826,His attackers allegedly drank blood,0
train_01_20_1823,observed attack police doubt Modiba said cross-examination,1
train_01_200_2197,Accusing CPM instigating violence said deaths result clashes Congress Marxists,1
train_01_201_2182,But Congress Union minister Murshidabad Adhir Chowdhury blamed Trinamool violence,0
train_01_202_2751,alleged police act prevent incidents despite party giving inputs violence beforehand,0
train_01_203_2496,The miscreants earlier CPM recently joined TMC responsible violence Chowdhury said,0
train_01_204_40,Beijing launched campaign educate Tibetan monks nuns unrest rocked Tibetan-populated areas March two thousand and eight,1
train_01_205_2900,The taxi strike left commuters stranded Johannesburg expected also disrupt matric pupils writing exams Monday Gauteng education department said,1
train_01_206_419,told possible one-day strike already affected Soweto,0
train_01_207_3035,Earlier Johannesburg metro police said strike expected also disrupt Reya Vaya bus service,1
train_01_208_1296,immediately clear triggered strike,0
train_01_209_2724,The National Taxi Council said call strike,0
train_01_21_1320,said one hundred metres away witnessed attack,0
train_01_210_1260,know strike called strike could informed commuters said president Philip Taaibosch,1
train_01_211_600,Sena legislators protest Yedyurappa first April two thousand and ten Prime Minister MUMBAI Shiv Sena workers including legislators today staged demonstrations Karnataka Chief Minister Yeddyurappa protesting forcible installation Kannadiga mayor Marathi-dominated Belgaum city,1
train_01_212_3330,The Sena members staged protest Gateway India adjacent Taj hotel Karnataka put,0
train_01_213_2034,The protesters shouted slogans Karnataka demanding Belgaum along Marathi speaking areas state merged Maharashtra,1
train_01_214_39,Yesterday fifty Karnataka Rakshana Vedike KRV activists taken custody allegedly tried attack members Maharashtra Ekikaran Samithi MES corporators Belgaum City Corporation,1
train_01_215_3378,Thousands demonstrators marched Hong Kong Saturday facing threat arrest increasingly severe warnings Beijing,0
train_01_216_155,Protesters clad head toe black carrying umbrellas orange helmets deviated route approved police took major road normally busy shopping district Mongkok,0
train_01_217_924,One group held black banner words The police overstepped others chanted release protesters arrested last two months demonstrations,0
train_01_218_1148,Protesters distributed protective gear face masks event clashes police used teargas demonstrators,0
train_01_219_2329,The previously banned march sanctioned police last minute one several protests weekend Hong Kong,0
train_01_22_2051,Modiba said saw aggressive strikers running alongside police Nyala charging police,0
train_01_220_1697,city enters ninth consecutive week protests movement shows signs abating public anger government spreads parts Hong Kong society,1
train_01_221_804,Thousands civil servants medical workers staff city finance sector rallied Thursday Friday protests planned weekend,0
train_01_222_2316,The protests began proposal allow extradition China pose serious challenge China authority city since one thousand nine hundred and ninety-seven returned British Chinese control,1
train_01_223_1491,recent days Beijing ramped condemnation protests describes riots accused western powers instigating unrest hurt China,0
train_01_224_2732,Thursday Chen Daoxiang head Chinese army garrison Hong Kong said military determined protect national sovereignty Hong Kong would help put intolerable unrest requested,1
train_01_225_2844,Hong Kong police Thursday also charged forty-four people linked protests rioting crime carries maximum penalty ten years prison,1
train_01_226_2880,online forums claims police decided allow previously banned protest Mongkok order surround demonstrators arrest masse,1
train_01_227_3356,peaceful marches disrupt road afternoon work maybe spills blockading roads maybe long,1
train_01_228_384,The statement condemned authorities turning deaf ear peaceful protests wide section society threatened actions,0
train_01_229_1111,integrated steel plant agriculture mineral-based industries set Kadapa district ensuring comprehensive development generate employment Communist Party India district secretary Narayana demanded addressing party functionaries staged dharna front Kadapa Collectorate Thursday,1
train_01_23_2014,The commission chaired retired Judge Ian Farlam investigating deaths forty-four people wage-related strike Lonmin platinum mining operations Marikana August two thousand and twelve,0
train_01_230_3249,ANDHRA PRADESH Work banks insurance firms hit August twenty-one two thousand and eight IST Back old days horse-drawn cart comes handy passengers autos went road general strike Kurnool Wednesday,0
train_01_231_84,CMP TIRUPATI The all-India general strike called trade unions Wednesday badly hit working PSU banks LIC General Insurance Companies Chittoor district,1
train_01_231_1897,Photo Credit Photo YOU Subramanyam Trade unions oppose move introduce comprehensive insurance bill,0
train_01_231_3359,UPA failure contain price line criticised Centre States accused sidelining,0
train_01_232_3228,Besides bank insurance company employees medical sales representatives members UTF anganwadi municipal construction workers hamalis including RTC porters participated rally taken banner leftist unions protesting anti-employee anti-national policies Congress-led UPA government,0
train_01_233_415,UPA criticised Demonstrations held front bank branches insurance company premises denouncing failure UPA government holding price line,1
train_01_234_598,Leaders Communist Party India Marxist Communist Party India TDP frontal units addressing rally lashed Central State governments nothing except chanting Indira Rajiv Sonia mantra grossly sideling National Common Minimum Programme,1
train_01_235_3084,Secretary Insurance Corporation Employees Union Nellore Division Gopalakrishnaiah leaders held demonstration front United India Insurance Company criticised UPA categorically said would strengthen LIC GICs opposite hiking cap Foreign Direct Investment insurance sector,0
train_01_236_368,Kurnool Work offices financial institutions came stand still account strike,1
train_01_237_2439,The members AITUC CITU Communist Party India Communist Party India Non Governmental Organizations bank insurance employees unions took rally,0
train_01_238_904,Seven Maoists Killed Gun Battle eighteenth February two thousand and fourteen Seven Maoists killed two-hour long gun battle Maharashtra Police border state shares Chhattisgarh top official said Tuesday,1
train_01_239_3190,The gun battle took place deep forests Bedhkati area near Gadchiroli-Gondia border around 11.30 . . late Monday said Gadchiroli Superintendent Police Haque,0
train_01_24_2580,August sixteen two thousand and twelve thirty-four people mostly mineworkers shot dead clash police trying disarm disperse,1
train_01_240_3405,The cross-firing lasted nearly two hours,0
train_01_241_137,Several hundred people occupied homes Delft Cape Flats way Cape High Court bid block impending eviction spokesman said,1
train_01_242_1120,Speaking 1pm Poni said hundreds residents demonstrated outside court way train High Court would make another attempt get urgent interdict,1
train_01_243_3351,Police clueless fifteen abducted Maoists fourth November two thousand and eleven Prime Minister PATNA Four days armed Maoists abducted fifteen people including twelve labourers Bihar Jamui district police still dark whereabouts failed rescue officials said Friday,0
train_01_244_1503,Police failed recover fifteen abducted people,0
