index,text,label
train_05_233_1140,Datta Gule auto union affiliated Maharashtra Navnirman Sena also participated strike,0
train_05_234_2257,Most unions support strike,0
train_05_235_1325,The strike called section,0
train_05_236_2465,The participating unions called daylong token strike five Kshirsagar said would enforce Monday traffic police ease pressure drivers,1
train_05_237_2952,police drive continues strike Monday Kshirsagar said,1
train_05_238_2445,Today Paper Jharkhand village group clash claims eight lives September twenty two thousand and six IST GRIEF-STRICKEN Family member tribal victim died clash Monday evening Tetratoli village near Kurkura Bazar Gumla district Jharkhand Tuesday,0
train_05_239_1984,Photo Credit Photo Arunangsu Roy Chowdhury People assembled spot discuss alleged atrocities Santi Sena Gumla Jharkhand Eight persons including two alleged criminal backgrounds killed dozen injured group clash Kurkura village Gumla district police said,1
train_05_24_2011,Seers protest arrest Banjara Hills police station seventeenth January two thousand and thirteen Scores VHP Bajrang Dal activists along religious seers staged protest front Banjara Hills police station till late night Wednesday demanding immediate release Swami Kamalananda Bharati,1
train_05_240_593,Six persons hailing different villages killed Surju Mahto member Santi Sena group fired random surrounded mob Tetartoli Kamdara police station seventy district headquarters Monday night,1
train_05_241_2353,Two others lynched mob suspected supporters group,1
train_05_242_193,The incident occurred large number people Kolebira Kamdara Bano Basia blocks assembled spot discuss alleged atrocities committed Santi Sena areas Deputy Inspector-General Ram Laxman Prasad said,1
train_05_243_573,Three houses torched incident,0
train_05_244_735,"5,000 docs quit crisis Rajasthan",1
train_05_244_2330,"Indian Express Press Trust India Press Trust India Jaipur Sat Dec twenty-four two thousand and eleven hrs The medical crisis Rajasthan due indefinite strike doctors crippled health services left dozen patients dead deepened Friday 5,000 doctors submitting resignations",1
train_05_245_1048,All doctors government hospitals dispensaries primary health centres resident doctors six medical colleges strike since December twenty-one demaning pay hike time-bound promotions,1
train_05_246_1908,Friday private doctors medical teachers also stopped work four two hours respectively support protesting government doctors,1
train_05_247_1834,"All Rajasthan Doctors Association handed resignations 5,000 doctors Friday",0
train_05_248_561,Several doctors different districts also forwarded resignation respective district collectors said vice-president association Mahesh Sharma,0
train_05_249_1542,"Around 30,000 truck drivers countrywide began striking better pay Tuesday",1
train_05_25_1214,The religious seers right-wing activists earlier arrested Khairatabad Crossroads marching towards Raj Bhavan meet governor submit representation release swami arrested Special Investigating Team SIT Monday delivering alleged hate speech Indira Park city January eight,1
train_05_250_1165,Several incidents violence intimidation severely affected distribution goods foodstuffs shops depots,1
train_05_251_3062,RFEA chief executive Nico Badenhorst said strike costing country R100 million day,1
train_05_252_2759,Tuesday twenty-nine truckers arrested Johannesburg city centre violent clashes police,1
train_05_253_2893,Engg students demand uniform rule ATKT Posted Fri Jan fifteen one thousand nine hundred and ninety-nine IST MUMBAI JANUARY fourteen Engineering students held demonstration University Mumbai campus Fort Wednesday demanding allowed keep term grant year,1
train_05_254_867,Wednesday demonstration second one organised help Bharatiya Vidyarti Sena BVS,1
train_05_255_2140,One held earlier month,0
train_05_256_1683,NIA chargesheet leaves crime branch red-faced twenty-sixth December two thousand and eleven Prime Minister NEW DELHI Mumbai Police elite Crime Branch probe role Fahim Ansari Sabbauddin Ahmed conspiracy behind 26/11 finds mention exhaustive charge sheet filed NIA regarding role Pakistani-American LeT terrorist David Headley Mumbai attack,0
train_05_257_2109,The sixty page charge sheet filed National Investigation Agency NIA Saturday special court New Delhi details reconnaissance activities carried fifty year-old Headley targets attacked Lashker-e-Taiba LeT terrorists November twenty-six two thousand and eight left one hundred and sixty-six people dead,1
train_05_258_2848,Mumbai Crime Branch accused Ansari Sabbauddin providing details targets attacked LeT sixty hour gun battle face embarrassment twice trial court Bombay High Court acquitted two saying evidence two,1
train_05_259_2105,Former Commissioner Mumbai Police Hasan Gafoor in-charge Crime Branch Rakesh Maria present head Anti Terror Squad repeatedly claimed Ansari Ahmed carried reconnaissance various targets attacked Lashkar terrorists November twenty-six two thousand and eight,0
train_05_26_780,Around 4.30 seventy member contingent VHP Bajrang Dal activists led leaders Yaman Singh nearly twenty religious heads went procession towards Raj Bhavan intention submit representation Narasimhan,1
train_05_260_1663,revision petition Crime Branch claimed Ansari Ahmed played role providing details Pakistan-based terror outfit targets attacked terrorists November twenty-six,0
train_05_261_1818,The investigation agency gone role Headley eight others including founder Lashker Hafiz Saeed mastermind 26/11 Zaki-you are-Rehman Lakhvi two serving Pakistani Army officials,0
train_05_262_2070,The statement Headley recruited Lashker authorities NIA magistrate forms one annexures charge sheet talks role carrying survey locations attacked terrorists 26/11,0
train_05_263_3251,The division bench Bombay High Court comprising justices Ranjana Desai More dismissing plea state government earlier year said view view taken learned Sessions Judge far involvement duo case concerned cannot called unreasonable palpably false manifestly erroneous demonstratively unsustainable merits interference,0
train_05_263_3282,The High court concurred view taken Sessions Judge map recovered killed terrorist pocket wrinkles blood spots LeT terrorist badly injured gun-fight,1
train_05_264_103,The NIA given details every target attacked LeT terrorists scouted Headley present Chicago jail . .,0
train_05_265_214,Upset Probe AIADMK Man Murder Wife Stages Stir,1
train_05_265_972,26th April two thousand and fourteen Nearly three months AIADMK functionary chased hacked death full public view near busy Chengalpattu government hospital victim wife relatives staged hunger strike demanding police arrest masterminded murder,1
train_05_266_1144,AIADMK functionary Rajagopal attacked crude bombs unidentified gang January twenty-eight travelling motorbike,0
train_05_267_2997,Though escaped impact bombs gang chased hacked death full view public,0
train_05_268_1656,Subsequently police arrested six persons connection murder eight others turned,1
train_05_269_819,However Friday Rajagopalan wife Jaya also AIADMK functionary alleged except one person none arrested actually involved murder,0
train_05_27_75,The march intercepted Khairatabad Crossroads marchers taken preventive custody,0
train_05_270_2675,About fifty relatives Rajagopalan put would began hunger strike around nine spot Rajagopalan hacked,0
train_05_271_1381,The protest continued 12.30,0
train_05_272_1449,Police officers arrived spot promised action convinced Jaya stop protest,1
train_05_273_742,She named seven persons including several panchayat presidents around Chengalpattu masterminds behind Rajagopalan murder,0
train_05_274_623,Heavy police presence seen area due protest,1
train_05_275_3155,The ordinance introduced reportedly neutralise quota agitation launched socially economically politically powerful Patel community state since July two thousand and fifteen,1
train_05_276_928,The Patels seeking quota OBC category pitched ten month-old agitation across state proved key factor exit Anandiben Patel Chief Minister,1
train_05_277_3096,Reacting news Hardik Patel face Patel quota stir called failure government,0
train_05_278_1001,bound rejected,0
train_05_278_3310,Hardik maintained Patels would continue agitation support demands,1
train_05_279_440,Police keeping watch Princess informal settlement Roodepoort West Rand Monday following protests last week,1
train_05_28_3235,They started performing pujas front police station shouted Jai Sri Ram,0
train_05_280_421,The protests started Tuesday residents demanding better service delivery housing,1
train_05_281_2951,Broken glass rocks broken traffic light debris scattered Albertina Sisulu Road protests,1
train_05_282_1687,Police metro police warned motorists stay away area last week protesters throwing stones passing vehicles,1
train_05_283_2586,September twenty-eight two thousand and ten IST TDP chief addresses maha dharna vicinity Anantapur Collector office Telugu Desam president Nara Chandrababu Naidu called upon cadre people prepared march State capital necessary Assembly pressurise government solve farmers problems,1
train_05_283_2992,ANANTAPUR Rosaiah Government failed fronts,0
train_05_284_2616,Addressing massive gathering party workers sympathisers around city maha dharna organised vicinity Collector office Monday Naidu said Rosaiah Government failed fronts neglected agriculture reflected acute shortage fertilizer faced farmers,1
train_05_285_2314,They instantly responded shouting firm,0
train_05_286_756,Soon addressed gathering District Collector Janardhan Reddy arrived venue received memorandum promised forward State government,0
train_05_287_584,December one two thousand and ten IST large number Communist Party India activists took procession protest Centre failure contain prices essential commodities also land scams reported State,1
train_05_287_2870,DAVANGERE Communist Party India protests price rise Davangere,1
train_05_288_2064,Police injured stone pelting twenty-ninth January two thousand and twelve JCBs pressed service road widening drive Kolar Saturday Express Photo KOLAR Tension prevailed Ammavarpet city protestors pelted stones police accompanied officials road-widening drive Saturday,1
train_05_289_1633,However JCBs started bringing structures Ammavarpet persons pelted stones police personnel,1
train_05_29_2219,Late night Bharatiya Janata Party state president Kishan Reddy also joined protest,0
train_05_290_2587,More seven hundred people also signed online petition government step extra funding,1
train_05_291_609,PUBLISHED Thursday eight May two thousand and fourteen Robust June four turnout spurs organisers call thirtieth anniversary,1
train_05_291_2358,Lawyer held marking anniversary Tiananmen protests allowed see attorneys,1
train_05_291_3036,five Jun two thousand and eighteen civil rights lawyer placed criminal detention attended event commemorating anniversary crackdown pro-democracy protests Tiananmen Square allowed see legal representatives,1
train_05_292_1661,took part Tiananmen pro-democracy protests one thousand nine hundred and eighty-nine detained picking quarrels provoking trouble charge frequently used activists,1
train_05_293_1617,least four people placed criminal detention attended low-key event house Beijing Saturday ahead twenty-fifth anniversary crackdown,1
train_05_294_1346,The Global Times state-run newspaper known hawkish stance said editorial event commemorate June four crackdown clearly crossed red line law related sensitive political issue China,1
train_05_295_1575,"two form human chain protest blocked road twenty-fourth July two thousand and sixteen BENGALURU unprecedented show strength around 2,000 residents Somasandrapalya Haraluru HSR Layout Kudlu Mangamanapalya Hosapalya surrounding areas gathered near Ravindra Bharathi Global School HSR Layout Saturday formed human chain near wall constructed Sobha Daffodil apartment",1
train_05_296_1040,"There four hundred and thirty-two apartments around 2,000 residents",0
train_05_296_3274,Emotions ran high citizens activists raised slogans Sobha Saturday,1
train_05_297_1095,Kavitha Reddy activist local resident said protest message builders encroachment acceptable,0
train_05_298_699,Many schoolchildren seen protesting along parents,0
train_05_299_259,ADILABAD TRS condemns arrests March eleven two thousand and eleven IST Telangana Rastra Samiti TRS Thursday condemned arrests Telangana protagonists Adilabad district foil Million March,1
train_05_3_1878,Heavily-armed militants Thursday morning attacked police station Kathua army camp Samba killing eight persons including security force personnel,1
train_05_30_1520,The protest continuing till reports last came,0
train_05_300_2879,The party maintained government shoulder responsibility violent incidents related agitation,0
train_05_301_2815,Addressing press conference TRS leader Goverdhan Reddy others said march success despite hurdles created government,1
train_05_302_1069,Meanwhile pro-Telangana activists banner Telangana Joint Action Committee formed human chain took oath,0
train_05_303_1842,one hundred and fifty activists proceeding towards Hyderabad detained police Thursday morning,0
train_05_304_2717,Attempts Karimnagar Staff Reporter adds The district police foiled attempts made TRS pro-Telangana activists proceed participate Million March Hyderabad Thursday arrests various routes proceeding capital,1
train_05_305_1639,Irked arrests protestors staged dharna,1
train_05_306_2306,The TRS students wing activists staged dharna front Karimnagar One Town police flaying arrests activists obstructing proceeding Hyderabad,1
train_05_307_939,Orders Nizamabad Staff Reporter adds Despite prohibitory orders imposed movement Telangana protagonists many district managed make twin cities take part Million March held Thursday,0
train_05_308_1458,"According reports around 4,000 -5,000 Telangana activists district participated march hoodwinking police",0
train_05_309_357,Since two passenger trains cancelled engaging private vehicles restricted vehicle thoroughly checked check-posts along National Highway seven many activists decided give march miss,1
train_05_31_680,number comrades arrested Pietermaritzburg accused involved directly indirectly killing comrades including murder comrade Musawenkosi Mchunu,1
train_05_310_2185,People remained glued television boxes watching incidents unfolded march,0
train_05_311_1973,Among arrested Nalgonda employees JAC convener TNGOs Union leader Venkateswar Murthy co-convener Amarender Reddy Communist Party India district secretary Adi Reddy,0
train_05_311_2771,Rally Nalgonda Correspondent adds Police took custody two hundred pro-Telangana activists sole purpose preventing going Hyderabad participation Million March scheduled take place one four . .,1
train_05_312_796,Several pro-Telangana activists arrested Choutuppal Bhongir Miryalguda Telugu Desam Party extended support agitation,0
train_05_313_871,The agitators staged rasto roko demonstrations Veligonda Nakrekal Choutuppal Bhongir towns district,0
train_05_314_546,curbs NIA questioning Sadhvi Pragya ninth July two thousand and twelve Prime Minister The Supreme Court Monday restrained National Investigation Agency interrogating Sadhvi Pragya Singh Thakur connection two thousand and seven murder Rashtriya Swayamsewak Sangh activist Sunil Joshi Madhya Pradesh,0
train_05_315_2125,Timeline major Maoist attacks seventeenth May two thousand and ten Prime Minister NEW DELHI The deadly Maoist guerrilla attack civilian bus Chhattisgarh Dantewada district Monday evening comes month Left rebels audacious April six attack security forces area killing seventy-six personnel,1
train_05_316_3101,Some major Maoist guerrilla attacks past April six two thousand and ten seventy-six security personnel seventy-five belonged Central Reserve Police Force CRPF slaughtered Maoists Chintalnar forested hamlet Dantewada district,0
train_05_317_1526,April four two thousand and ten Maoists detonate powerful landmine blow police bus Koraput district Orissa killing around ten Special Operations Group personnel injuring sixteen,1
train_05_318_1685,March twenty-three two thousand and ten Maoists blast railway track Bihar Gaya district causing derailment Bhubaneswar-New Delhi Rajdhani Express,1
train_05_319_800,day landmine attack Orissa leaves empty freight train derailed hitting railway services Howrah-Mumbai route,1
train_05_32_1256,Mchunu ANC activist former councillor shot dead May turning driveway kwaPata area Pietermaritzburg,0
train_05_320_2388,Feb fifteen two thousand and ten Around one hundred Maoists storm police camp Silda West Bengal killing twenty-four policemen looting arms,1
train_05_321_725,Oct eight two thousand and nine seventeen policemen killed ambush Maoists Laheri police station Gadchiroli district Maharashtra,1
train_05_322_383,July twenty-seven two thousand and nine Six CRPF men killed landmine blast Dantewada district Chhattisgarh,1
train_05_323_1000,July twelve two thousand and nine Three separate attacks Rajnandgaon district Chhattisgarh claim lives thirty security personnel,1
train_05_324_1513,June twenty-three two thousand and nine group motorcycle-borne armed Maoists open fire Lakhisarai district court premises Bihar free four men,1
train_05_33_757,Taxi protest march shuts Rustenburg Molaole Montsho RUSTENBURG September twelve ANA Commuters left stranded businesses closed Thursday taxi industry embarked protest march gender based violence,1
train_05_34_449,About five hundred minibus taxis drove slow speed R104 corridor Tlhabane road town,0
train_05_35_2263,They stopped intersection Beneden Tambo Drive near taxi rank drove city,0
train_05_36_2151,Those leading march foot waved white placards various messages solidarity women,0
train_05_37_701,Police monitoring march,0
train_05_38_3335,police helicopter circled protest march reached town,0
train_05_39_3240,Despite march peaceful businesses inner city closed,1
train_05_4_1156,condemn twin dastardly attacks,0
train_05_40_457,Objecting counsel Sasikala one accused case Manishankhar senior counsel Kumar submitted work Chennai court days matter therefore taken either July eleven July twelve Chowta pointed proceedings possible days wake state Bar Council strike July thirteen Acharya present Delhi also member Central Law Commission,1
train_05_41_2947,Sources said regulation plying trains ten five various sections South Eastern Railway SER continuing since May twenty-eight last year derailment Jnaneswari Express West Bengal suspected Maoists,1
train_05_42_2919,RDSC held numerous agitations restoration night movement trains,1
train_05_43_3042,Residents also stoned police vehicles,0
train_05_44_2659,July twenty-two two thousand and ten IST Water Resources Minister Basavaraj Bommai represents Shiggaon Assembly Constituency directed Deputy Commissioner Haveri conduct inquiry incident members Bhangi community Savanur staged protest pouring faeces heads,1
train_05_44_2723,HAVERI told probe Savanur protest,0
train_05_45_2537,Bommai visited Savanur Wednesday along officials elected representatives asked Deputy Commissioner inquire circumstances forced community members stage protest,1
train_05_46_625,The Minister earlier met people staged bizarre protest front Savanur municipality Tuesday assured would forced move houses,0
train_05_47_2130,Bommai later told presspersons whoever responsible forcing protestors stage protest would dealt sternly,1
train_05_48_184,Deepu THIRUVANANTHAPURAM The Kerala State Road Transport Corporation KSRTC suffering operational loss Government viewing loss said Chief Minister Oommen Chandy,0
train_05_48_817,KSRTC suffering operational loss,0
train_05_48_1233,12th April two thousand and twelve Police removing VSDP workers tried disrupt flag function Rajadhani ring road service city Wednesday,1
train_05_49_1521,They one East Fort Eanchakkal Bypass Kazhakoottam Pothencode Venjarammoodu Vembayam Palayam East Fort Three VSDP activists held police attempting disrupt flag function Rajadhani ring road service KSRTC,1
train_05_5_2631,allegedly part mob looting shops protests underway town,0
train_05_50_0,The activists shouted slogan VSDP zindabad advanced towards Chief Minister began address,0
train_05_51_2086,Outside court supporters protesting calling court released together charged,1
train_05_52_1468,His supporters chanted waved placards calling state agencies used political matters,1
train_05_53_2948,Free Napoleon six others read one placard another read Stop police brutality,0
train_05_54_882,Thursday Phatsha told commission consider disarming occur police Nyalas armoured vehicles started deploying barbed wire hill strikers assembled,1
train_05_55_1645,August sixteen thirty-four striking mineworkers shot dead seventy-eight injured police opened fire trying disperse group gathered hill near mine,1
train_05_56_2556,Hong Kong police fired teargas demonstrators moved disperse crowds protesters stormed legislative council building raised territory former colonial flag twenty-second anniversary handover China,1
train_05_57_592,The dramatic scenes came peaceful march half million people made way parts city deepest political crisis two decades showed sign abating,1
train_05_58_126,The police action came breakaway group protesters forced way legislative council building vandalised main chamber,0
train_05_59_662,They climbed barricades put protesters earlier day charged people gathered,0
train_05_6_3298,Last week protests started Boitumelong township neighbouring Bloemhof,0
train_05_60_365,Protesters hours repeatedly striking reinforced glass walls metal trolley poles hundreds others watched,0
train_05_61_873,Once inside threw chairs tore defaced portraits past lawmakers,0
train_05_62_1397,After protesters dispersed images vandalised building broadcast,0
train_05_63_1297,More fifty people reportedly taken hospital treatment various protests throughout day,0
train_05_64_1451,know whether would work channels make Carrie Lam listen said male protester outside legislative council building declined named,0
train_05_65_2172,Police issued several warnings evening appeared gearing violent clashes left protesters largely unhindered efforts even group tore inside building,1
train_05_65_2308,used protest peacefully work need get framework tell willing try anything give answer,1
train_05_66_1313,Local footage showed police officers armed non-lethal weaponry parts government complex protesters broke,0
train_05_67_1871,"The movement large peaceful young people overwhelmed strong sense helplessness emotionally charged While small splinter group causing trouble legislature 550,000 people marched peacefully downtown Hong Kong without scenes violence chaos",0
train_05_68_2932,The organisers rally Civil Human Rights Front CHRF issued joint statement democratic lawmakers placing blame destruction legislative council squarely Lam saying ignored demands people pushed youngsters towards desperation,1
train_05_69_1183,Lam called rare press conference early Tuesday condemn extremely violent storming legislature described heartbreaking shocking,1
train_05_7_1581,Monday residents blocked N12 set alight municipal office community hall houses belonging mayor two councillors two officials several businesses,0
train_05_70_1258,Speaking beside Lam police chief Stephen said Protesters violent acts far exceeded bottom line peaceful expressions demands joint statement forty-one pro-government lawmakers condemned described extremely radical violent acts occupying roads vandalism council building,0
train_05_71_1104,The rallies latest manifestation growing fears China stamping city freedoms culture help finance hub pro-Beijing leaders,1
train_05_72_2058,While recent protests initially sparked Lam attempts pass proposed extradition legislation demonstrations morphed wider movement administration Beijing,1
train_05_73_1421,The protesters mostly orderly obeying traffic laws cleaning allowing ambulances pass even tens thousands gathered,0
train_05_74_2696,midnight police far restrained use force criticised actions protesters smaller protest twelve June fired one hundred and fifty rounds teargas rubber bullets videos police beating pepper-spraying unarmed protesters circulated internet,1
train_05_75_2521,speech Lam referred protests saying made realise need grasp public sentiments accurately,1
train_05_76_1105,miner speaking English showed Association Mineworkers Construction Union Amcu leader Joseph Mathunjwa areas striking mine workers shot police,0
train_05_77_1798,Some reports since event suggested several miners shot dead among rocks distance police clashed workers,0
train_05_78_1911,turned blind eye outburst communal violence Malda instigators perpetrators belong referred majority community,1
train_05_79_1530,None shoot lip hip time come barrels blazing whenever tattered secular fabric appears endangered courage even whisper time may work lunatic fringe miscreants belonging creed,0
train_05_8_2780,Tuesday protest spilled Coverdale Christiana community hall torched,0
train_05_80_802,happened Malda trivial incident much trouble taken keep Bharatiya Janata Party Communist Party India fact-finding team ground zero,0
train_05_81_2376,The burnt-down police station repaired given fresh coat paint overnight,1
train_05_82_2492,Terrorist attack Pathankot airbase exposed another chink media armour,1
train_05_83_1602,The Pathankot incident exposed far malignant cancer corruption spread,1
train_05_84_1590,ninety-five Youth Arrested Attack Ambur cops,1
train_05_84_2180,29th June two thousand and fifteen VELLORE many ninety-five youth arrested deadly attack police personnel Ambur Town Saturday night left thirty-eight police personnel including women couple civilians injured connection death Shameel Ahmed,1
