index,text,label
train_08_101_1931,KALPETTA AIYF activists stall bank work November twenty-four two thousand and eleven IST Activists Mananthavady taluk committee All India Youth Federation AIYF youth organisation Communist Party India Communist Party India stalled work Mananthavady branch Punjab National Bank Wednesday protest bank alleged move appoint agencies recover overdue loan amounts farmers district,1
train_08_102_1647,TAMIL NADU TNGEA members stage demonstration April twenty-nine two thousand and ten IST Staff Reporter Tirupur The Tamil Nadu Government Employees Association TNGEA members staged demonstration front Collectorate Tuesday evening asking government scrap contributory pension scheme among demands,1
train_08_103_456,Western Cape police arrested three people public violence following service delivery protests Philippi Cape Flats Friday,1
train_08_104_1280,Police used rubber bullets disperse group three hundred people protesting poor service delivery Landsdowne Road Superintendent Riaan Pool said,1
train_08_105_2931,The incident followed similar one area around Friday police used rubber bullets,0
train_08_106_448,Posted Thu Apr two one thousand nine hundred and ninety-eight IST BHOPAL April one Indian people tribunal presided former Bombay High Court judge Deshmukh reach Multai Betul district April eight investigate circumstances police firing agitating farmers January twelve resulted death nineteen persons,1
train_08_106_3193,Multai firing judge head tribunal,0
train_08_107_3389,Announcing press conference Tuesday Suneelam led agitation said Kisan Sangharsh Samiti would hold mahapanchayat Parmandal village April twelve chalk future plan action,1
train_08_108_303,said Chief Minister announced role non-official persons agitation subsequent police firing would inquired CBI,0
train_08_109_1698,Meanwhile Suneelam claimed farmers agitation completely peaceful provided provocation police open fire,1
train_08_11_140,The organisers bandh included many Kannada organisations Dalit organisations heads religious maths force business establishments hotels close establishments everybody support bandh call appeared voluntary,0
train_08_110_1733,KARNATAKA Action sought March twelve two thousand and nine IST Bijapur Members Mahila Jana Sangha Dalit Sangharsha Samiti picketed office Superintendent Police demanding action women police officials allegedly harassed Savitri Chalwadi Manguli village district Tuesday,1
train_08_111_3105,Disgruntled miners Xstrata mine Thorncliffe Limpopo went rampage Friday morning police said,0
train_08_112_402,They blockaded roads leading Sekhukhune Burgersfort Brigadier Hangwani Mulaudzi said,0
train_08_113_1464,Several cars pelted stones truck bus torched,0
train_08_114_3032,Mulaudzi could confirm reports miners demonstrating Xstrata fired,1
train_08_115_3169,The violence abated Friday afternoon police still keeping watch,0
train_08_116_2585,two Shiv Sainiks held threat Navale Posted Wed Jul twenty-two one thousand nine hundred and ninety-eight IST July twenty-one The Cuffe Parade police today arrested two persons registered case rioting eighteen others connection surprise attack bungalows Shiv Sena minister Suresh Navale former minister Gulabrao Gavande,1
train_08_117_298,Deputy commissioner police zone Bishnoi told Express Newsline two hundred policemen including two inspectors eighteen sub-inspectors deployed around ministers bungalows near Mantralaya MLA hostel senior Sena members allegedly threatened Monday,1
train_08_118_220,police officer patrolling area told newspaper considerable confusion police force cops know check time ministers targetted partymen,1
train_08_119_1628,North West protestors barricaded national road South Africa Botswana Saturday reported SABC news,0
train_08_12_2558,Though police assured people full protection bandh business establishments remained closed,1
train_08_120_2782,The protestors apparently protesting water shortages Ntsweletsoku village Lehurutshe North West,1
train_08_121_2761,Municipal workers went area clear road chased away angry residents said SABC,1
train_08_122_2908,Protestors made road completely impassable adding stones,1
train_08_123_168,The Centre decided hold tripartite talks United Naga Council UNC Manipur government end ongoing blockade two national highways Manipur disrupted normal life led shortage essential commodities State,1
train_08_123_968,January thirty-one two thousand and seventeen IST Tripartite dialogue mooted United Naga Council State government ongoing highway blockade,1
train_08_123_1742,New Delhi Centre hold talks end Manipur crisis,1
train_08_124_2863,The economic blockade imposed UNC umbrella body Naga groups patronage National Socialist Council Nagaland Isak-Muivah Manipur government decision carve seven new districts continued four months,1
train_08_125_1302,Ending deadlock The Union government even sought Attorney General Mukul Rohatgi opinion end economic blockade,1
train_08_126_424,Manipur going polls March four eight due ongoing economic blockade kept sensitive category official said adding elections held two phases first time State,1
train_08_127_2809,NAMAKKAL Power loom workers strike continues May three two thousand and fifteen IST With third round talks wage hike failed yield results power loom workers Pallipalayam continued indefinite strike sixth consecutive day,1
train_08_128_3095,However trade unions refused accept continued strike,1
train_08_129_703,Earlier PRP president flagged rally differently abled persons Oriental College,0
train_08_13_2449,Braving scorching sun hundreds people including many women led Sri Mahanta Shivacharyaru Sulpul Math Sri Rajashekar Shivacharyaru Guru Mahanta Shivacharyaru Hiremath Pala Shivanda Swamigalu Sonna Dasoha Math Gangadhar Swamigalu Chowdapur Math Kanchi Basava Shivacharyaru Roza Math battery Congress leaders including DCC president Allamprabhu Patil MLC former Mayor Chandrika Parameshwar zilla panchayat member Ambaraya Ashtagi former president HKCCI Umakant Nigudgi Karnataka Rakshana Vedike president Arunkumar Patil Hyderabad Karnataka Janapara Sangarsh Samiti Laxman Dasti others marched Super Market Deputy Commissioner office register protest insensitive indifferent attitude Government genuine demands pourakarmikas,1
train_08_130_1193,March fifteen two thousand and sixteen IST Union Public Service Commission UPSC aspirants staged protest near Parliament House Monday demanding compensation form additional attempts say lost due discriminatory Civil Services Aptitude Test CSAT paper preliminary examination,1
train_08_130_2993,NEW DELHI UPSC aspirants stage protest detained,1
train_08_131_311,similar protest held March three,0
train_08_132_1184,But spite controversial nature CSAT removed April two thousand and fifteen massive protests said Anupama Karthik aspirant Hyderabad,1
train_08_133_436,This false propaganda carried agitation Singur,1
train_08_134_937,visited Morampalli Banjar village Burgampad mandal today extend support padayatra taken Communist Party India separate Telangana,1
train_08_135_1261,Speaking occasion said Sonia Gandhi interest according statehood Telangana,0
train_08_136_1800,The popular social network blocked since ethnic riots China far west two thousand and nine Instagram banned pro-democracy protests Hong Kong two thousand and fourteen,1
train_08_137_318,Indian Express Express News Service Express News Service Lucknow Wed Mar six two thousand and thirteen hrs The Legislative Council paralysed second consecutive day Tuesday opposition parties disrupted proceedings demanding arrest killers Kunda DySP Ziaul Haque gunned Balipur village Pratapgarh district last Saturday,1
train_08_137_2363,Legislative Council paralysed second day,0
train_08_138_1613,NEW DELHI Senior leaders lend support Girri protest June twenty-one two thousand and sixteen IST The protest Bharatiya Janata Party Mahiesh Girri outside Arvind Kejriwal residence grew Monday Page four,0
train_08_139_3409,TAMIL NADU Communist Party India cadre stage demonstration Angry lot Communist Party India cadre staging demonstration front Revenue Divisional Office Krishnagiri Friday,0
train_08_14_1980,The protesters raised slogans State Government police arresting nearly seventy Dalits incident stones thrown police personnel Tarfail slum,1
train_08_140_1529,Photo Credit Photo Bashkaran April eighteen two thousand and nine IST Staff Reporter KRISHNAGIRI Cadres Communist Party India Marxist staged demonstration front Revenue Divisional Office Krishnagiri Friday condemning attack party MLA unidentified persons Madurai Wednesday night,1
train_08_141_2473,Michael Raj town secretary led demonstration,0
train_08_142_3231,The cadres also held demonstrations taluk headquarters Krishnagiri Dharmapuri districts condemning attack,1
train_08_143_1837,September fourteen two thousand and seventeen IST Demands management Somaiya College reinstate teachers Teachers affiliated Mumbai Junior College Teachers Union Wednesday protested sacking three junior faculty members Somaiya College Arts Commerce Vidyavihar,1
train_08_143_2480,Mumbai Teachers union protests sacking junior faculty,0
train_08_144_3354,Kulkarni present protest said One day management summoned told services required anymore,0
train_08_145_1371,The teachers well-versed subjects four years experience Other teachers college expressed concern issue take part protests,0
train_08_146_171,Meanwhile anti-GJM outfits area observed twelve hour strike Terai Dooars region Sunday,0
train_08_147_888,Party Vice-President Ram Kishore Singh threatened put Modi behind bars following Muzaffarnagar riots state government received alerts possible communal unrest,1
train_08_148_1811,May two thousand and twelve Karnataka Police arrested Kafeel Akthar Darbhanga alleged role Chinnaswamy Stadium attacks two thousand and ten Nitish raged illegal,1
train_08_149_1023,behind bomb blasts Pune Delhi Hyderabad Bangalore Mumbai,0
train_08_15_2614,They alleged police tried intimidate religious leaders pressured withdraw bandh call issued notices saying untoward incident bandh would held responsible,1
train_08_150_3360,Only CPM enmity towards says Rema twenty-seventh February two thousand and thirteen Rema wife slain leader Chandrasekharan stuck statement Special Additional District Sessions Court Marad cases CPM enmity towards husband denied suggestions made defence counsel,1
train_08_151_855,She deposing court second day Tuesday part trial Chandrasekharan murder case,0
train_08_152_3252,She told Special Judge Narayana Pisharadi CPM Onchiyam area secretary Asokan area committee member Krishnan Kunnummakkara local committee member Ramachandran taken march front house Onchiyam raising slogan Chandrasekharan body would draped white cloth May four two thousand and twelve day murdered Chandrasekharan left home around 12.30,0
train_08_153_2838,She came know killed Vallikadu father mother reached home around one May five two thousand and twelve added Rema,0
train_08_154_2828,reply argument defence counsel UDF used murder Chandrasekharan political gain blaming CPM killing Rema told court right,1
train_08_155_3094,CPM leaders hatched conspiracy killed brutally using hired killers,0
train_08_156_249,February seventeen two thousand and seventeen IST Pro-Congress employees continue boycotting duties organise satyagraha Monday,0
train_08_156_1927,Today Paper One-day agitation KAS cripples Secretariat,1
train_08_156_2362,strike called section employees government decision include government Secretariat Kerala Administrative Service KAS crippled functioning State administrative headquarters Thursday,1
train_08_157_2355,While protesters claimed seventy-eight employees responded strike called Kerala Secretariat Association Kerala Secretariat Employees Sangh government pegged turnout fifty-six,0
train_08_158_3337,The Kerala Secretariat Employees Association affiliated Communist Party India join strike,0
train_08_159_2334,Though Chief Secretary Vijayanand called employees representatives talks Wednesday failed reach accord Secretariat Association affiliated Congress Employees Sangh called one-day strike,1
train_08_16_726,Incidentally first time police slapped notices organisers bandh citing Supreme Court ruling holding organisers bandh responsible untoward incident occurred bandh period,1
train_08_160_1780,Decision challenged Members Secretariat Association war path staying offices protest decision,1
train_08_161_715,Association leader Benny said members availed casual leave Wednesday mark protest would continue boycott duties organise twenty-four hour satyagraha Secretariat February twenty,1
train_08_162_2819,KSEA general secretary Bijukuttan termed protest section employees farcical exercise,0
train_08_163_3163,Their decision continue agitation would deemed irresponsible act challenges public,0
train_08_164_2860,Chief Minister Pinarayi Vijayan directed heads departments initiate disciplinary action employees boycotting work signing attendance register name protest monitoring closed circuit camera visuals,1
train_08_165_1658,The decision continue agitation would deemed irresponsible act challenges public,0
train_08_166_2636,early hours six May Beijing police detained Zhiqiang prominent human rights lawyer helped organise one thousand nine hundred and eighty-nine demonstration three days prior participated private panel discussion commemorating massacre,1
train_08_167_1052,Gao imprisoned one thousand nine hundred and ninety-three charge writings one thousand nine hundred and eighty-nine demonstrations,1
train_08_168_455,Hong Kong must become breeding ground hate Susan Chan denounces abuse perpetrated radical protest groups PUBLISHED Monday sixteen March two thousand and fifteen recent weeks protests organised parallel trading New Territories Tsim Sha Tsui,1
train_08_169_603,The scenes getting ugly disturbing shops forced close people parallel traders molested bullied,1
train_08_17_420,Neither swamijis Kanta accepted notices police personnel pasted notices doors religious math venue Kanta hunger strike,0
train_08_170_269,Although people organised events try blame government happened clear strong message radical irrational activities must sent across society sake tourism economy defence Hong Kong core values,1
train_08_171_62,22nd September two thousand and eleven AGRA The crude improvised explosive device IED used Sep seventeen Agra blast injured four people unique design investigators said Thursday adding local welders contacted lead Haldwani also followed,1
train_08_171_1960,Agra blast bomb unique welding design police,0
train_08_172_3113,The low-intensity explosion took place Sep seventeen around 5.30 . . reception area Jai Hospital situated service lane National Highway two barely 2.5 Taj Mahal declared terror target frequented thousands tourists domestic foreign,0
train_08_173_2015,Local welders contacted thousand mobile numbers around vicinity explosion screened sources added,0
train_08_174_1399,The earlier reports rivalry among nursing homes resulting explosion ruled,1
train_08_175_1485,Indian Express PTI PTI Guwahati Sat Aug three two thousand and thirteen hrs Violence continued rock Karbi Anglong district various government offices torched train tracks removed activists different organisations today demanding separate state lines Telangana,1
train_08_175_2352,Statehood demand Fresh violence rocks Assam Karbi Anglong district,0
train_08_176_1767,The agitationists set ablaze veterinary irrigation agriculture health Integrated Child Development Service ICDS Public Works Department PWD offices across district last night officials said today,0
train_08_177_2876,The protestors removed portion railway track Diphu Doldoli stations today halting train movement said,1
train_08_178_2003,Flag marches army called civil administration continuing across violence-hit district area domination instill confidence among people officials said,1
train_08_179_1989,Lawyers Gherao Puri Collectorate ninth December two thousand and fourteen PURI Hundreds members Puri Bar Association gheraoed collectorate staged road blockade six hours Monday demanding stringent action Puri tehsil staff assaulted lawyer Biranchi Das Wednesday,1
train_08_18_1098,SCHOOL Meghalaya June two two thousand and fourteen IST thirteen Curfew Saturday relaxed eight hours Meghalaya West Garo Hills district two days imposed following mob violence death suspected militant police custody officials said,1
train_08_180_514,The lawyers strike since Thursday incident,1
train_08_181_2719,Monday agitating lawyers wanted meet District Magistrate absence met Additional District Magistrate Udhab Charan Majhi Sub-Collector Madhusudan Das asked call strike,0
train_08_182_914,continue boycott work courts till District Magistrate looks demands Samal said,1
train_08_183_1039,city witnessed terror strike four months ago security establishment left stones unturned ensure incident-free celebrations,1
train_08_184_1693,April nine two thousand and thirteen IST Part power sub-station Naxal-dominated Jamui district forty-eight hour-bandh called Maoists protest killing ten cadres Jharkhand recently drew close Sunday night Maoists wreaked havoc various parts Bihar,1
train_08_184_2347,Patna Maoists blast power station Bihar,0
train_08_185_1630,About hundred Maoists blew part power sub-station Naxal-dominated Jamui district affecting power supply area,1
train_08_186_320,One room power station blasted,0
train_08_187_222,The incident took place jurisdiction Khaira police station,0
train_08_188_329,Maoists also struck Airtel mobile tower Aurangabad district late Sunday,0
train_08_189_1539,Between eleven . . twelve midnight set fire tower Kutumba police station area,0
train_08_19_77,Prime Minister condemns dastardly attack Congress workers Chhattisgarh,0
train_08_19_1490,Indian Express PTI PTI New Delhi Sun May twenty-six two thousand and thirteen hrs Prime Minister Manmohan Singh tonight strongly condemned dastardly Maoists attack Congress leaders workers Chhattisgarh appealed attackers release earliest may abducted,1
train_08_190_2333,Muzaffarpur district twenty-five thirty Maoists attacked premises Saaj Infracon Patna-based company briefly took around ten fifteen labourers hostage make good escape,1
train_08_191_2365,The incident took place Sahebganj police station area 12.30 1.30 . . They first set two JCBs excavating machines two tractors fire,0
train_08_192_3398,They took workers sleeping including JCB tractor drivers one fearing police retaliation,1
train_08_193_1576,About three hundred police camp Sewra CRPF CoBRA Combat Battalions Resolute Action teams discovered bombs embedded road,0
train_08_194_671,TIRUNELVELI Give house sites Lankan expatriates June thirteen two thousand and thirteen IST Communist Party India M-L members stage demo Demanding free house sites eighteen Sri Lankan expatriate families Communist Party India Marxist-Leninist members staged demonstration front railway junction Tuesday,1
train_08_195_1986,District secretary Sankarapandian led protest,0
train_08_196_1015,expected talk experiences seventy-nine day umbrella movement protests Hong Kong two thousand and fourteen,0
train_08_197_3216,Being turned back one thing getting hurt disappearing another said author book Hong Kong umbrella movement protests,0
train_08_198_336,The Left leaders pointed ongoing plantation workers stir affects 3.5 lakh plantation workers across state hence serious social issue,1
train_08_199_1985,detailed submission LDF delegation comprising Communist Party India parliamentary party leader Divakaran Mathew Thomas Janata Dal Saseendran NCP made strong case citing recent struggle better wages women plantation workers Munnar,0
train_08_2_2258,said Operation Barricade conducted first time Mumbai terror attack last year,0
train_08_20_1965,Singh spoke Chhattisgarh Chief Minister Raman Singh violent incident offered help rescue relief operations,0
train_08_200_3139,Ruling Gives Hope Death Row Convicts Rajiv Case twenty-first January two thousand and fourteen Prime Minister The Supreme Court verdict commuting death penalty fifteen convicts given hope three death row convicts Rajiv Gandhi assassination case could get similar relief MDMK leader Vaiko said Tuesday,1
train_08_201_2028,said ulterior motive Karunanidhi comments made election speech Puducherry Thursday riots ensued following demolition mosque,1
train_08_202_2053,Tribal leader Edunga Gamamgo found murdered Odisha twenty-third May two thousand and sixteen Prime Minister BERHAMPUR prominent adivasi leader former president Lok Sangram Manch Ganjam district unit today found murdered front house Kumarabandh village,0
train_08_203_1552,The police however suspect old enmity might reason behind murder,1
train_08_204_2164,Senior police officers went spot considerable tension area following murder,1
train_08_205_2342,Some locals gheraoed policemen village investigation demanding immediate arrest culprits,1
train_08_206_1600,Their ages range nineteen thirty years arrested connection incidents public violence campus included continuous stoning Police Service members said police spokeswoman Brigadier Sally Beer,1
train_08_207_163,The police denied allegations targeting leaders student protests order thwart FeesMustFall campaign arrest former Witwatersrand University Student Representative Council president Mcebo Dlamini,1
train_08_208_1585,The resumption lectures NMMU Wednesday marred disruptions running battles police protesters continued,1
train_08_209_282,This week acting police commissioner Lt-Gen Khomotso Phahlane said five hundred and sixty-seven people arrested student protests two hundred and sixty-five cases last eight months,1
train_08_21_1926,Describing incident dastardly anti-democratic act Singh said Government take firm action perpetrators violence kind,1
train_08_210_414,seventh suspect arrested murder ANC North West official Obuti Chika Hawks said Friday,1
train_08_211_3019,suspect pulled trigger killed Chika,1
train_08_212_3271,Chika thirty-three shot point-blank range driveway home Alabama Klerksdorp December fourteen,0
train_08_213_1947,Rahul Assures Strict Action Tanzanian Student Assault Case fifth February two thousand and sixteen Prime Minister NEW DELHI Under attack Bharatiya Janata Party silent Rahul Gandhi today said strict action taken alleged assault stripping Tanzanian student Bangalore triggered nationwide outrage,1
train_08_214_1756,Nine persons arrested far since incident happened Sunday night twenty-one year-old Tanzanian student went ordeal vigilante justice angry mob case mistaken identity woman mowed car driven Sudanese,1
train_08_215_2240,The Tanzanian woman reportedly dragged car seated along three friends reached accident spot miscreants mistaking caused fatal accident though Sudanese involved police said,1
train_08_216_2186,Karnataka Home Minister Parameshwara denied Tanzanian woman stripped paraded naked claiming racial attack,0
train_08_217_2205,India suspended talks Pakistani gunmen attacked Mumbai last year saying would resumed till Islamabad showed concrete action meeting India concerns cross-border terrorism,1
train_08_218_3277,Former Team Anna members extend support sacked Maruti workers twenty-first September two thousand and twelve Prime Minister Several national-level trade union leaders along former Team Anna members Friday demanded cancellation termination orders sacked Maruti workers end four month-long lockout Eastern Medikit union leader said,0
train_08_219_1802,Trade unions different political hues including Centre Trade Unions Indian National Trade Union Congress Hind Mazdoor Sabha held rally,0
train_08_22_1483,said strongly condemn violent attack Congress leaders workers Chhattisgarh today,0
train_08_220_3160,Former team Anna members Prashant Bhushan Sanjay Singh also addressed gathering,0
train_08_221_3149,They also demanded end unofficial lockout Eastern Medikit four plants Udyog Vihar,0
train_08_222_1840,"More 1,200 permanent six hundred casual workers protesting jobs salaries",1
train_08_223_344,TAMIL NADU Post blasts web security tightens May twenty-nine two thousand and fourteen IST Railway stations places worship cinema halls malls enhanced protective measures everywhere The May Day twin blasts platform nine Chennai Central sent strong message various enforcement agencies city,1
train_08_224_3273,City police constituted teams carry regular inspection malls following blasts,1
train_08_225_3182,Soon heat dust twin blasts settled city policemen worked overtime step security arrangements city schools among important establishments scanner,1
train_08_226_1444,Communist Party India leader Sitaram Yechury reacting reference made Bharatiya Janata Party leader Advani public meetings,0
train_08_226_2129,December nineteen two thousand and seven IST Kanwar Yogendra SHIMLA The Communist Party India Tuesday questioned Bharatiya Janata Party opposition tough measures taken West Bengal government Maoists Nandigram set liberated zone,1
train_08_226_2453,NATIONAL Yechury takes dig Advani Nandigram,0
train_08_227_1719,said Home Minister Shivraj Patil said Parliament violence State due Maoists barricaded village prevented villagers return,1
train_08_228_852,The violence followed Nandigram due Bharatiya Janata Party criticising Communist Party India added,1
train_08_229_2459,Yechury said thirty-six Communist Party India cadres killed violence,0
train_08_23_1438,wished speedy recovery injured attack including senior Congress leader Shukla,0
train_08_230_2108,violent protest occurred outside school hospital Saturday rumours spread girl critical condition,1
train_08_231_2779,The police official said around seventeen people arrested destroying damaging government vehicles property,1
