index,text,label
train_02_99_2624,The entire protest celebrations began Mangal Pandey joined Rani Lakshmi Bai Maulavi Ahmedullah Shah Rao Sahib Tantia Tope Azimullah Khan Kunwar Singh Rajput chief Jagadishpur Firuz Saha Pran Sukh Yadav Rao Tula Ram Rewari refused food water leaders people India letting every single person fought freedom,1
train_03_0_2147,Hani leader SACP chief staff Umkhonto Sizwe armed wing African National Congress ANC assassinated ten April one thousand nine hundred and ninety-three,0
train_03_1_131,Protests rock Ramban killings Curfew Valley,1
train_03_1_2511,19th July two thousand and thirteen Prime Minister Protests rocked several areas Jammu division today protest firing incident Ramban curfew remained force even authorities stopped fresh batch Amarnath pilgrims leaving shrine,1
train_03_10_1944,Vijaykumar Assistant Director Agriculture Department rushed spot informed farmers staging dharna front department assured protesters would meet demands fifteen days,0
train_03_100_63,Its mangled remains thrown five hundred metres blast spot,0
train_03_101_3285,Initially confusion whether cylinder blast police confirmed bomb blast using high-intensity explosive,0
train_03_102_2883,cannot jump conclusions motive behind blast,0
train_03_103_3305,rumour also circulated one blast Hebbal police denied,0
train_03_104_2080,Leung Chun-ying second meet-the-public session Kwun Tong much quieter affair first one last week caused uproar quarters expressing support police handling protest Mong Kok rival groups clashed teacher verbal attack officers,1
train_03_105_2043,The event Kwun Tong Kung Lok Government School largely peaceful although minor clashes two camps Leung entered end,0
train_03_106_3022,Bharatiya Janata Party CPM cadre resort fisticuffs Delhi six hundred held twenty-third May two thousand and sixteen NEW DELHI CLASHES Bharatiya Janata Party CPM Kerala Left victory Assembly elections found echo national capital Sunday Bharatiya Janata Party team seeking President Pranab Mukherjee intervention stop brawls state,1
train_03_107_2515,streets general sense animosity prevailed CPM Bharatiya Janata Party workers scuffled outside AKG Centre six hundred people detained,1
train_03_108_1816,Bharatiya Janata Party workers broke barriers damaged signboard outside CPM office,0
train_03_109_632,The CPM workers came building confront protesters minor scuffle ensued,1
train_03_11_2437,Farmers stage dharna Harihar grants released far officials,0
train_03_110_1342,Union minister Nitin Gadkari led Bharatiya Janata Party delegation met President told reporters Bharatiya Janata Party RSS workers facing atrocities CPM Kerala,0
train_03_111_2037,Our worker Pramod killed,0
train_03_112_1145,Houses one hundred workers vandalised,0
train_03_113_3266,hope faith democracy condemn violence Gadkari said,0
train_03_114_1422,CPM general secretary Sitaram Yechury alleged Bharatiya Janata Party RSS workers started bout violence Kerala attacking victory procession Kannur,1
train_03_115_1177,This happened across state,0
train_03_116_1519,Bail cancellation plea Raneef dismissed fourth January two thousand and eleven NEWDELHI The Supreme Court dismissed petition filed Kerala Government seeking cancellation bail Raneef one accused hand-chopping Joseph,0
train_03_117_2354,July four seven persons Popular Front India intercepted car colege lecturer Joseph working Newman College chopped palm,0
train_03_118_548,ensuing attack victim son attacked one assailants,0
train_03_119_2208,This caused injury accused thirty-seven case,0
train_03_12_394,The performance comes time instruction city history becoming increasingly politicised recent government attempts bury details may embarrassing China,0
train_03_120_947,The High Court granted bail ground participate direct assault,1
train_03_121_1863,The Ernakulam Sessions Court Monday granted bail first accused Jaffer second accused Asharaf Joseph hand chopping case,0
train_03_122_607,September four two thousand and fourteen IST Officials promise supply water tankers Women took streets carrying pots protest erratic supply drinking water Kelamagalam Udhanapalli Wednesday,1
train_03_122_663,KRISHNAGIRI DHARMAPURI Water supply disrupted villagers block road,1
train_03_123_1648,The protesters blocked Rayakottai road,0
train_03_124_1996,Balagangamanahalli panchayat Dharmapuri residents Eechampatti village laid siege Nallampalli BDO office protest non supply water,1
train_03_125_2910,Meanwhile around two lakh fishermen Tamil Nadu Puducherry strike demanding return detained fishing boats Sri Lanka,1
train_03_126_673,Indian Express Agencies Agencies Bangalore Fri Jul twenty-seven two thousand and twelve hrs Karnataka Assembly today witnessed brief dharna entire opposition members protesting government move pass Finance Bill without tabling annual performance reports various departments,1
train_03_126_1479,Opp stages dharna Karna assembly Finance Bill,1
train_03_127_121,Shettar assured House would take action erring officials following opposition including JDS members withdrew dharna,1
train_03_128_2054,Special team probe fourth April two thousand and nine THIRUVANANTHAPURAM special team led City Control Room Assistant Commissioner Suresh Kumar inquire destruction Chattambi Swami idol Kannammoola,0
train_03_129_3304,City Police Commissioner Ravada Chandrasekhar also directed Shangumugham Assistant Commissioner Suresh Kumar probe role police incident including allegation LDF candidate Ramachandran Nair pushed Pettah Circle Inspector,0
train_03_13_1572,About twenty volunteers dressed period British military uniforms gathering streets city past month mark seventy-fifth anniversary Black Christmas one thousand nine hundred and forty-one British forces Hong Kong surrendered Japanese first ever Crown colony,1
train_03_130_2774,The Home Department also submitted detailed report Wednesday incident Kannammoola Election Commission,0
train_03_131_3068,But miscreants destroyed Chattambi Swami idol Kannammoola could identified even thirty-six hours incident,0
train_03_132_1555,threatened Bharatiya Janata Party candidate Krishnadas began fast front controversial plot Kannammoola Thursday morning,0
train_03_133_447,noon veteran Bharatiya Janata Party leader Rajagopal took fast Krishnadas campaigning,1
train_03_134_3212,Rajagopal concluded fast evening Home Minister office informed Bharatiya Janata Party leaders report sent Election Commission,1
train_03_135_851,The fast Bharatiya Janata Party leaders inaugurated NSS Taluk Union president Sangeeth Kumar,0
train_03_136_578,said peaceful strike demanding memorial Chattambi Swami continue till government takes decision issue,0
train_03_137_2096,The strike intensified consulting like-minded people added,1
train_03_138_747,The idol Chattambi Swami make-shift temple front seventeen cent plot believed birthplace Chattambi Swami Kannammoola destroyed miscreants Tuesday night,0
train_03_139_1173,Protestors activists Janmasthana Samrakshana Samithy alleged idol destroyed directed Sandhya,0
train_03_14_1558,The textbooks syllabus try sidestep so-called embarrassing issues like June fourth one thousand nine hundred and sixty-seven riots Pang added referring date one thousand nine hundred and eighty-nine Tiananmen Square massacre event spurred 1.5 million people quarter population time march Hong Kong largest ever protest,0
train_03_140_3213,Tirupur AIADMK DMK activists clash October twenty-one two thousand and eleven IST The Vellakoil police Wednesday night registered cases three activists DMK AIADMK charges assaulting near polling booth Veerasolapuram panchayat,1
train_03_141_940,The police said two factions got engaged fight following wordy duel poll issues,1
train_03_142_1349,another incident Udumalpet police booked cases Mustalif Hakkim DMDK AIADMK candidates contesting councillors Ward eight Udumalpet Municipality respectively engaging similar clashes,1
train_03_143_1390,The university planned increased despite FeesMustFall protests caused unrest turned violent towards end year,1
train_03_144_1262,Wits students held protests demanding realisation free quality decolonised education line call FeesMustFall movement,1
train_03_145_2578,two questioned Ramajayam murder second April two thousand and twelve TIRUNELVELI Police Sunday picked two persons Tirunelveli district connection murder Ramajayam regarding life threat issued brother former DMK minister Nehru Sunday,1
train_03_146_524,The police questioned Sanmugavel regarding threat call Nehru,0
train_03_147_215,Four persons arrested Sunday connection making life threat calls former minister Nehru,1
train_03_148_611,The caller threatened kill former minister saying Nehru would next target brother Ramajayam,0
train_03_149_1820,The threat came two days Ramajayam murder,0
train_03_15_2667,Last year Hong Kong police revised history section website remove references leftists Communists agitators bomb makers months deadly rioting one thousand nine hundred and sixty-seven,1
train_03_150_2461,CHENNAI Give free hand police Karunanidhi September twenty-seven two thousand and sixteen IST DMK leader Karunanidhi Monday alleged violence broke Coimbatore Tirupur districts following murder Hindu Munnani spokesperson Sasikumar police given free hand deal situation,1
train_03_151_3202,Unacceptable behaviour While demanding arrest Sasikumar murderers Karunanidhi said causing damage public private property wake murder unacceptable,0
train_03_152_1958,ANDHRA PRADESH Women stage dharna gas connection October four two thousand and eight IST Staff Reporter WARANGAL Hundreds women aegis Communist Party India staged dharna Collectorate demanding free gas connection,1
train_03_153_2756,Members several Self Help Groups SHGs reached town sporting placards raising slogans,0
train_03_154_2803,The interdict followed incident morning two security guards chased Durban building site striking workers,1
train_03_155_299,Our attorneys written letter union expressing concern violence site today Thursday said,0
train_03_156_2315,small group workers seen attempting burn notices issued management informed workers industrial action taken non-NUM members illegal strike,0
train_03_157_1240,Metro police intervened fire put,0
train_03_158_3093,Hundreds workers gathered stadium 7.30 Thursday continuing second day NUM strike windy cloudy conditions,0
train_03_159_2565,The strike may continue next week said,0
train_03_16_2283,The decision taken following demonstration staged group persons natives Salem registered District Employment Office DEO post,1
train_03_160_8,Even strike continuing Group Five-WBHO Consortium Wednesday gave reassurance construction stadium track delivery stadium jeopardy,0
train_03_161_18,More thousand workers downed tools 7am Wednesday talks management failed Tuesday,1
train_03_162_830,05th May two thousand and fourteen People representatives human rights activists relatives four workers Orissa killed fire mishap plywood factory Paravoor April sixteen staged protest front Collectorate demanding thorough probe alleged role factory management mishap Saturday,1
train_03_162_879,Fire Mishap Victims Kin Seek Probe,0
train_03_163_1532,The people protesting alleged factory owner Abdul Majeed also unwilling hand bodies family forced cremate Pachalam cremation centre,0
train_03_164_942,Law locals free-for-all nineteenth October two thousand and nine The clash police local people Palode Sunday,0
train_03_165_2991,THIRUVANANTHAPURAM Several persons including police personnel hurt clashes local people police Palode near Nedumangad Thiruvananthapuram district Sunday,1
train_03_166_521,About twenty police personnel including Nedumangad DySP Sukeshan Palode circle inspector Anil Kumar sub-inspector Anil Kumar Pangode sub-inspector Praveen number local people belonging various political parties injured clashes,1
train_03_167_302,The trouble started shifting Palode sub-registrar office rented building Perungamala panchayat functioning several years newly built government-owned building one hundred metres away Nandiyodu panchayat,1
train_03_168_3242,The clashes allegedly sparked local people pelting stones police party,1
train_03_169_1860,violence mounted police hurled teargas shells grenades mob,0
train_03_17_764,Demonstration The agitators demonstrated education officials started handing appointment orders selected candidates demanding inquiry determine genuineness address proof submitted migrated candidates,1
train_03_170_2830,police jeep several two-wheelers damaged,0
train_03_171_2332,The Palode police registered case three hundred persons connection incident,0
train_03_172_2099,The trade union federation said march thousands women Union Buildings Pretoria one thousand nine hundred and fifty-six pass books turning point history,0
train_03_173_1691,"day one thousand nine hundred and fifty-six around 20,000 women participated national march protest pass law legislation required non-white South Africans carry document prove allowed enter white areas",1
train_03_174_988,Women races ages corners country marched Union Buildings Pretoria,0
train_03_175_1622,The march organised Federation South African Women Fedsaw led Helen Joseph Rahima Moosa Sophie Williams Lilian Ngoyi,0
train_03_176_824,Mineworkers across North West decided combine strike efforts workers representative said Rustenburg Saturday,0
train_03_177_3411,realised weak point way striking one one Sphamandla Makahanya said Anglo American Platinum Amplats strike rally Olympia Park Stadium,0
train_03_178_2368,More thousand striking workers gathered mass rally,0
train_03_179_687,The crowd singing dancing police Nyalas vans kept watch proceedings,0
train_03_18_1221,They gheroed Chief Educational Officer Sethurama Varma,0
train_03_180_305,The strike still,0
train_03_181_314,They wildcat strike since September twelve demanding paid minimum R16 zero month,1
train_03_182_1227,ANDHRA PRADESH Delay compensation ryots lay siege MRO office March fourteen two thousand and six IST Staff Reporter Telugu Desam Communist Party India leaders lead protest VIJAYAWADA Betel nut farmers Garikaparru Thotlavalluru villages Thotlavalluru mandal laid siege Mandal Revenue Office Monday,0
train_03_183_3119,Taking strong exception inordinate delay release promised compensation crop loss August two thousand and five floods nearly fifty farmers led Telugu Desam Party MPTC member Gurumurthy local Communist Party India leaders Krishna Babu Kondala Babu squatted MRO,1
train_03_184_426,Efforts persuade farmers relent failed yield result irate farmers continued protest till late evening,1
train_03_185_1760,The strike Anglo American Platinum Amplats Rustenburg continue Rustenburg strike co-ordinating committee said Monday,0
train_03_186_264,The strike,0
train_03_187_203,Amplats said offered reinstate workers terms conditions employment applied illegal strike,0
train_03_188_2310,The company offered once-off hardship allowance R2000 help workers deal financial difficulties arising no-work no-pay principle place striking,1
train_03_189_2007,Workers participate strike would receive once-off loyalty allowance R2000,0
train_03_19_59,MANGALORE Communist Party India demands release Vittal Malekudiya,0
train_03_19_2074,May nineteen two thousand and twelve IST Members Dakshina Kannada Udupi district units Communist Party India Communist Party India staged protest front Deputy Commissioner office Friday condemning Bharatiya Janata Party Government arresting Vittala Malekudiya postgraduate student Mass Communication Journalism Mangalore University alleged links Maoists,1
train_03_190_1403,Amplats workers went strike September twelve demanding monthly salary R16 zero,1
train_03_191_2602,Prolonged strikes may lead company closing said Congress Trade Unions rally Rustenburg,1
train_03_192_2295,PTI GAYA twenty year-old youth shot dead allegedly YOU MLC Manorama Devi son Rocky overtaking vehicle near police line Bihar Gaya district triggering protests area,1
train_03_193_803,The youth murder took political overtones morning Leader Opposition LoP Prem Kumar meeting family members victim express sorrow later addressed large number people blocked road near Mahabir bridge protest murder,1
train_03_194_1514,The protesters led Gaya district unit Bharatiya Janata Party President Anil Swami raised slogans district police demanding arrest prime accused murder case,1
train_03_195_3410,Parties ask resume talks HYDERABAD JANUARY twenty-one day Maoists bandh marked bloodshed uneasy calm continued state even Telangana Rashtra Samiti TRS pressurised government halt encounters resume dialogue militants,1
train_03_196_1599,Chief Minister Rajasekhara Reddy sought details exchange fire Karimnagar yesterday student killed police firing,0
train_03_197_1667,Meanwhile isolated incident Naxalites blew telephone exchange Perur village Devarakadra mandal Mahaboobnagar district early hours today,0
train_03_198_1835,"The move seen highly controversial sparked 13,000 take streets protest ended clashes police",1
train_03_199_2726,"separate extremely rare protest 2,000 members legal profession marched Beijing meddling local legal system",1
train_03_2_6,Additional forces deployed sensitive areas day four persons killed forty-four others including security personnel injured stone-pelting resultant firing mob attacked BSF camp Ramban district alleged high-handedness BSF team,1
train_03_20_1024,Kakkillaya former MLA senior party leader freedom fighter addressed gathering said Government release student along father Linganna Malekudiya immediately ensure education continued,0
train_03_200_2160,Mandya Farmers protest outflow KRS increased September twenty-five two thousand and fifteen IST Even water-level Krishnaraja Sagar near Srirangapatna plummeting steeply rate outflow increased Thursday evening,1
train_03_201_3368,Following hundreds farmers different parts district leadership Melkote MLA Puttannaiah staged protest near KRS entrance Thursday evening,0
train_03_202_491,Thiruvananthapuram Protest assault woman Kochi June twenty-five two thousand and eleven IST Dozens people including women took Freedom Walk main thoroughfare city Thursday midnight protest alleged assault Tasni Banu woman BPO employee Infopark Kochi days ago,1
train_03_203_1966,The march started Martyrs Column Palayam concluded Secretariat,0
train_03_204_2929,The participants raised slogans demanding stern action check atrocities women name moral policing,1
train_03_205_1335,Suraj presided protest meeting,0
train_03_206_1343,Tens thousands pro-democracy protesters marched across Hong Kong mark twentieth anniversary return Chinese control high-profile show dissent,1
train_03_207_835,China president Jinping former British colony three-day tour flew Hong Kong hours annual protest kicked Victoria Park Saturday afternoon,0
train_03_208_1219,know gone back Beijing still want show ignore voice said Howard Cheng twenty-eight one leaders group organises rally Civil Human Rights Front CHRF,0
train_03_209_628,"Organisers said 60,000 people joined 3km march held nearly every year since Hong Kong returned China one thousand nine hundred and ninety-seven",0
train_03_209_3174,fight democracy universal suffrage,1
train_03_21_1411,HUBLI Support Anna Hazare December twenty-nine two thousand and eleven IST Day two dharna organised India Against Corruption Hubli support anti-corruption activist Anna Hazare attracted people various sections society,0
train_03_210_644,Saturday rally followed massive pro-Beijing firework display celebrating anniversary kicked 3.30 local time,0
train_03_211_2826,column protestors surged westwards park towards Hong Kong financial centre carrying flags banners yellow umbrellas symbol two thousand and fourteen mass protests stamped words Power people,0
train_03_212_1119,Many demonstrators carried messages dissent black white T-shirts emblazoned slogans Never back fight Hong Kong poetically born uncertain times carries certain responsibilities,0
train_03_213_768,tell world Nathan Law local pro-democracy legislator among leading rally told Guardian,0
train_03_214_862,Eddie Chu thirty-nine year-old environmentalist pro-democracy politician said rally important chance show power people,0
train_03_215_1705,This need Jason Leung sixteen year-old protestor marching poster carrying rather different message,0
train_03_216_825,think selfish explained teenager first rally said come wanted experience first-hand Hong Kong vibrant democracy movement,1
train_03_217_218,Hong Kong China Jinping hundreds kilometres away time Saturday protest began left demonstrators clear message departure,0
train_03_218_2084,said address protests began Hong Kong must used launchpad challenge Beijing authority questioning China sovereignty territory crosses red line,0
train_03_219_822,Both issues remain deeply unpopular among city residents previous government attempts enact security legislation national education sparked mass protests,1
train_03_22_2482,Wednesday troupe folk artistes joined protests Kittur Chennamma Circle,0
train_03_220_1026,absolutely impermissible Little hour speech democracy protesters attacked pro-China demonstrators hauled away police attempted march daily flag-raising ceremony,1
train_03_221_1032,Thousands heavily armed troops paraded cities China troubled far west officials vowing thunderous anti-terror crackdown apparent upsurge deadly ethnic violence,1
train_03_222_3374,The parades come two separate eruptions bloodletting claimed dozen lives Xinjiang sprawling border region blighted repeated outbreaks ethnic violence terrorist attacks,0
train_03_223_1915,Last Tuesday three machete-wielding attackers reported gunned police killed five civilians Hotan Pishan county,1
train_03_224_2589,twenty-eight December four assailants reportedly shot dead using home-made explosives launch deadly assault government compound Karakax county,1
train_03_225_496,China says Islamic extremists separatists behind attacks although human rights activists suspect much violence driven resentment Communist party rule among region predominantly Muslim ethnic Uighur population,1
train_03_226_1942,Chen gone opposite direction military parades quite remarkable really saw similar-type events two thousand and nine riots talking response really small knife attack Hotan,0
train_03_227_2085,proportion would say level violence seen Xinjiang year,0
train_03_227_2281,China leaders declared people war terror two thousand and fourteen series attacks took place linked Xinjiang,1
train_03_228_1286,Those incidents included street bombing Urumqi knife attack civilians train station Kunming car-bomb attack Beijing Tiananmen Square,0
train_03_229_2254,However recent killings period relative calm appeared descended region,0
train_03_23_2517,getting news Hazare breaking fast ended dharna,0
train_03_230_913,07th April two thousand and sixteen Students Jammu University shout slogans protest rally police action non-Kashmiri students NIT,1
train_03_230_966,Srinagar Jammu PTI SRINAGAR Tension prevailed NIT outstation students today making slew demands including shifting institute Kashmir action policemen involved lathicharge yesterday HRD team rushed Delhi resolve crisis witnessed since last six days,1
train_03_230_2641,Tension Outstation Students Seek Shifting Out NIT,0
train_03_231_978,The developments prestigious engineering institute also triggered politicking even state government assured safety ensured students hailing states campus CRPF deployed instill sense security,0
train_03_232_1441,day lathicharge local police agitating non-local students campus Union HRD Ministry rushed three-member team Sanjeev Sharma Director Technical Education ministry Deputy Director Finance Fazal Mehmood Chairman Board Governors NIT JZarabi morning,0
train_03_233_2765,The students said police taken away national flag clash Friday last demanded returned,0
train_03_234_2041,The students assembled hall inside NIT campus also demanded strict action police personnel including Deputy Superintendent Police resorted lathicharge yesterday,0
train_03_235_1190,also demand DySP change statement said students hurled stones police said student speaking behalf rest,0
train_03_236_2274,officers touch agitating students family members,0
train_03_237_2730,Seeking allay apprehensions students feared agitation bearing academic performance exams due Union Minister said HRD team stay NIT Srinagar till exams begin April eleven,1
train_03_238_2637,want say assured injustice done Irani said adding Mehbooba assured enquiry ordered clashes inside NIT campus,0
train_03_239_1870,Home Minister Rajnath Singh campaigning West Bengal assembly polls said spoken Mehbooba gave assurance students safe would enquire incident happened fix responsibility,0
train_03_24_87,Battle continues Poonch district seventh January two thousand and nine Prime Minister Soldiers gun-battle militants Bhati Dhar forest Poonch district,0
train_03_240_1030,Earlier letter HRD ministry NIT administration students demanded hoisting national flag action staff involved anti-national activities replacing Jammu Kashmir Police CRPF security NIT campus gripped tension following clashes wake India loss West Indies World twenty Cup,1
train_03_241_1155,Members Mamelodi community staged protest High Court Thursday complaining jail bail extended,1
train_03_242_372,They waved placards slogans Justice must done Stop killing mothers,0
train_03_243_1174,The SAHRC investigated Tatane death protest Ficksburg April two thousand and eleven followed complaint Council Advancement Constitution,1
train_03_244_2506,found police suitably equipped quell public disorder protest failed devise plan regulate monitor protest,0
train_03_245_2994,also found police failed authorise suitably qualified experienced member represent consultations negotiations protest,0
